title,abstract,year,citationCount,url,paperId,authors
Stronger control-surveillance systems for vector-borne Chagas disease,"The multinational initiatives for the control/surveillance of Chagas launched by disease-endemic countries and the Pan American Health Organization-World Health Organization (PAHO-WHO) contributed to control house-infesting triatomine-bug populations and to reduce disease incidence. However, after 30 years, Chagas disease (CD) transmission persists the Americas. In their recent review, Rojas de Arias et al.(1) highlight the ‘practical impossibility’ of interrupting vector-borne Trypanosoma cruzi transmission, due to the zoonotic nature of most transmission cycles, with well over 100 vector species widely spread across the Americas. Then, Rojas de Arias et al.(1) emphasise the need for stronger surveillance systems to monitor and control CD. Here, I will (1) briefly discuss the prospects for interrupting vector-borne T. cruzi transmission and (2) provide an overview of some innovative approaches that, I believe, can play important roles in the development and operation of stronger control-surveillance systems for vector-borne CD. Disease control needs clear goals, and those goals often heavily depend on the natural history, risk factors, transmission routes and dynamics, pathogenesis, and treatment of the disease. Eradication, elimination, reduction of incidence, reduction of the number of severe cases, and reduction of fatality rates are all possible goals of disease control programs. (2) The most ambitious goal is disease eradication the complete elimination of an infection, with no new cases recorded in the absence of control measures. Eradication is practically impossible for zoonoses such as CD, whose etiological agent can be transmitted by 150+ vector species and infects a wide range of wild vertebrate hosts from the USA to Patagonia.(3) Therefore, the objective of a CD control program cannot be eradication, at least in the Americas. The main goal of the multinational initiatives against CD was the elimination of the strongly synanthropic, non-native populations of a few “primary” vectors mainly Triatoma infestans and Rhodnius prolixus.(4) Elimination of R. prolixus from Mexico and some countries of Central America was certified in 2011 by PAHO/WHO, but R. prolixus-infested houses were detected in rural sites in Mexico after certification.(5) Moreover, a new record of T. infestans in Mexico was recorded after 50 years.(6) In Peru, non-native T. infestans populations were not controlled in Arequipa (see references in Rojas de Arias et al.(1)). In addition, T. infestans residual foci have been detected in Brazil after certification.(7) Overall, these data indicate that elimination of non-native populations of “primary” vectors is feasible, but has many challenges. Elimination may not be the best goal for native vectors of CD.(8,9) There is a high species richness of Triatominae in the Americas.(3) Moreover, it is important to highlight that the response of some native species to vector control with insecticides was not the same as that observed for non-native species. In Brazil, for example, insecticide spraying reduced dramatically T. infestans distribution, but no significant reduction in distribution was observed for most native species. Moreover, the interruption of chemical treatment was systematically followed by recolonisation of native species,(10) mainly in unplastered houses.(11) In the state of Bahia, there was a clear reduction in the distribution of T. infestans and an increase in the relative abundance and distribution of T. sordida and T. pseudomaculata after 40 years of the vectorcontrol program. The high frequency of native triatomine species invading houses in the Americas in recent years(7,12,13) highlights the need to reinforce entomological surveillance actions to prevent CD. WHO established goals for controlling CD by 2030, including the interruption of transmission through vectorial, transfusion, transplantation and congenital routes in many endemic countries.(14) Achieving those goals is feasible for non-vector-borne transmission,(15) but many challenges remain for vector-borne transmission. Thus, I agree with de Rojas Arias et al.(1) that the WHO 2030 goal of interrupting vector-borne transmission seems unfeasible because: (i) wild triatomine populations are widespread, (ii) surveillance methods for synanthropic triatomines are not perfect, and (iii) CD still has low visibility and priority. Thus, it is necessary to reinforce the surveillance of vector-borne transmission of CD. In the next paragraphs I will highlight some innovative strategies that could help strengthen this surveillance: (I) online training for health agents (II) development of apps to identify vectors and improve surveillance with community participation and citizen science, (III) vector-borne transmission-risk mapping.",2023,4,https://www.semanticscholar.org/paper/8fa1818c05fd6f097382ba1499457595b0d6de12,8fa1818c05fd6f097382ba1499457595b0d6de12,R. Gurgel-Gonçalves
A comprehensive review on potential candidates for the treatment of chagas disease,"Twenty different infectious disorders induced by bacteria, viruses, and parasites are categorized as neglected tropical diseases (NTDs) by WHO. The severity of chagas disease remains a major concern in endemic areas and an emerging public health hazard in nonendemic countries. Trypanosoma cruzi, the etiological agent of this NTD, is mostly transmitted by triatomine vectors and comprises a range of epidemiologically significant variants. Current chemotherapeutics are obsolete, and one of the primary reasons for treatment cessation is their poor safety and effectiveness. Due to the aforementioned challenges, researchers are now focusing on discovering alternative novel safe, and economically reachable therapies for the treatment of trypanosomiasis. Certain target‐based drugs that target specific biochemical processes of the causative parasites have been described as potential antichagasic agents that possesses various types of heterocyclic scaffolds. These flexible molecules have a wide range of biological actions, and various synthesized compounds with strong activity have been documented. This review aims to discuss the available literature on synthetic anti‐T. cruzi drugs that will give a food for thought to medicinal chemists thriving to design and develop such drugs. Furthermore, some of the studies discussed herein are concerned with the potential of novel drugs to block new viable sites in T. cruzi.",2023,3,https://www.semanticscholar.org/paper/9cbf20b330ab6da8d0bc7e7f8a340eac61a57b2b,9cbf20b330ab6da8d0bc7e7f8a340eac61a57b2b,"Shilpi Pathak, Muskan Bhardwaj, N. Agrawal, Aditya Bhardwaj"
"Canine Systemic Insecticides Fluralaner and Lotilaner Induce Acute Mortality of Triatoma gerstaeckeri, North American Vector of the Chagas Disease Parasite","ABSTRACT. Chagas disease is a health concern for humans and animals across the Americas, and control options targeting the triatomine vectors of Trypanosoma cruzi, the causative agent of Chagas disease, are limited. Host-targeted interventions may be a useful and underused tool in controlling the spread of T. cruzi from vectors to hosts. Domestic dogs are known to be key bloodmeal hosts for triatomines as well as T. cruzi reservoirs and may be an effective and practical target for host-targeted insecticide deployment. We hypothesized that treating dogs with commercially available systemic insecticides (labeled for flea and tick control) would result in mortality of triatomines after consuming treated blood. We enrolled 16 privately owned dogs into five treatment groups to receive either fluralaner (Bravecto) or lotilaner (Credelio), alone or in combination with ivermectin. Blood from dogs before the initiation of treatment served as controls. Blood was collected 0, 7, 30, 45, and 90 days after the initial canine insecticide treatment and fed to 10 Triatoma gerstaeckeri nymphs through a membrane feeder, and survival was tracked daily for 7 days and weekly thereafter. All triatomines in the control and ivermectin groups survived the initial period, with no significant difference in long-term survival. In contrast, 99.7% of triatomines that fed on blood from dogs treated with either fluralaner or lotilaner died within 3 days. Although the impact of canine treatment on suppressing vector populations is unknown, fluralaner and lotilaner appear to be a compelling option for an integrated vector management approach to triatomine control.",2023,3,https://www.semanticscholar.org/paper/946a3ab7728f99a98ac98b5407338369930cd4b3,946a3ab7728f99a98ac98b5407338369930cd4b3,"Rachel E. Busselman, Italo B Zecca, G. Hamer, S. Hamer"
"Occurrence and distribution of Panstrongylus megistus (Burmeister, 1835) (Hemiptera, Reduviidae) in a metropolitan area of Southern Brazil","ABSTRACT Two triatomine genera (Panstrongylus and Triatoma) have essentially been recorded in Rio Grande do Sul State, Brazil. Panstrongylus megistus should be highlighted since this species is one of the main vectors of Trypanosoma cruzi in Brazil, due to its wide geographical distribution and the high susceptibility to this protozoan. This study aimed to present not only the occurrence and distribution of P. megistus in the Porto Alegre city’s metropolitan area (PAMA), Rio Grande do Sul State, Brazil, but also the rates of T. cruzi infection, from 2009 to 2020. The PAMA, which comprises 34 cities and 4.4 million habitants, extends across the transition area in two biomes – Pampa and Mata Atlantica – found in the state. Results showed that P. megistus was recorded in 76.5% of cities (i.e., 26 out of 34), mainly in Porto Alegre city, where the vector was found in 11 out of the 12 years that were monitored. Three hundred and nineteen specimens were captured. Two hundred and sixty-seven specimens (83.7%) were located intradomicile (p < 0.0001), while 52.3% positivity for T. cruzi was found. Thus, P. megistus is important in the PAMA, because it invades and colonizes the households. Moreover, the high rates of T. cruzi infection have drawn attention.",2023,1,https://www.semanticscholar.org/paper/2165161989fba67e79f719555c34791a5b6a93e2,2165161989fba67e79f719555c34791a5b6a93e2,"F. Mello, G. Souza, Cleonara Bedin, Marcelo Bergamin Duarte, Í. F. Leon, M. Villela"
"Accidental importation of the vector of Chagas disease, Triatoma rubrofasciata (De Geer, 1773) (Hemiptera, Reduviidae, Triatominae), in Europe","Members of the subfamily Triatominae (Hemiptera; Reduviidae) are vectors of American trypanosomiasis, also called Chagas disease. These insects feed on blood and are capable of transmitting protozoa belonging to the genus Trypanosoma (Kinetoplastea), with T. cruzi (Chagas, 1909) being the most important vector for human and companion animal disease. Vector-borne transmission can occur through contamination of a mucous membrane or a skin opening by triatomine fecal material after a bite. Another important means of transmission is oral ingestion of contaminated unpasteurized food or drink that contains the triatomine insect or its fecal material. Most species of Triatoninae are distributed in the Americas, but a few are found in the Far East and India. One of them, Triatoma rubrofasciata, is widely distributed worldwide (Dujardin et al. 2015). The unique reference to T. rubrofasciata near Europe is from the island of Santa Maria, the southeastern-most in the Azores archipelago with a humid subtropical climate. The assignment of its presence to Europe (Schofield and Galvão 2009) would be confusing or erroneous due to the location of this Portuguese archipelago with respect to North Africa and Europe, in the middle of the Atlantic Ocean. The first known citation there occurred in 1979 (Lent and Wygodzinsky 1979), but the authors did not refer to any collection data (point/date). The presence of T. rubrofasciata seems stable in the Azores, as it was included as part of the fauna of the island of Santa Maria in 2010 but, surprisingly, the species has not been collected in the rest of the islands, although it has remained in the Azores for at least 31 years (1979-2010) (Borges et al. 2010). Triatoma rubriofasciata is considered to be a poor vector of T. cruzi and it was associated with transmission in only three cases in the Americas (Lent and Wygodzinsky 1979) but not in China or Vietnam, where the species is more abundant (Hieu et al. 2019), thus it is rarely associated with T. cruzi transmission. This may be due to the long defecation timing of this species that lowers the transmission possibility to mammal hosts (Braga and Lima 1999). Nevertheless, in the Far East, this species has become a public health problem due to the numerous bites that can become more severe by swelling, itching, and secondary infection (Hieu et al. 2019, Shi et al. 2020). Several anaphylactic reactions have also been reported in Hawaii and China, (Wang and Peng 2006, Anderson and Belnap 2015). In the Far East, T. rubrofasciata is found in all habitat types, especially in urban and peri-urban and to a lesser extent in rural areas (Dujardin et al. 2015, Hieu et al. 2019). In buildings, vector abundance decreases with increasing floor levels (Hieu et al. 2019). The specimen was studied morphologically and the taxonomical identification was conducted on the basis of the key diagnostic characters (Lent and Wygodzinsky 1979):",2023,1,https://www.semanticscholar.org/paper/9f7576b5d75d28b8920cffc3562fc6d68015641c,9f7576b5d75d28b8920cffc3562fc6d68015641c,"F. Collantes, Juan Francisco Campos-Serrano, I. Ruíz-Arrondo"
Metacyclogenesis as the Starting Point of Chagas Disease,"Chagas disease is a neglected infectious disease caused by the protozoan Trypanosoma cruzi, primarily transmitted by triatomine vectors, and it threatens approximately seventy-five million people worldwide. This parasite undergoes a complex life cycle, transitioning between hosts and shifting from extracellular to intracellular stages. To ensure its survival in these diverse environments, T. cruzi undergoes extreme morphological and molecular changes. The metacyclic trypomastigote (MT) form, which arises from the metacyclogenesis (MTG) process in the triatomine hindgut, serves as a crucial link between the insect and human hosts and can be considered the starting point of Chagas disease. This review provides an overview of the current knowledge regarding the parasite’s life cycle, molecular pathways, and mechanisms involved in metabolic and morphological adaptations during MTG, enabling the MT to evade the immune system and successfully infect human cells.",2023,1,https://www.semanticscholar.org/paper/76105a524e802ffd76884b88d06e336f4a5974b0,76105a524e802ffd76884b88d06e336f4a5974b0,"Alessandro Zanard Lopes Ferreira, C. D. de Araújo, Isabela Cunha Costa Cardoso, Karen Stephanie de Souza Mangabeira, A. Rocha, Sébastien Charneau, Jaime Martins Santana, F. N. Motta, I.M.D. Bastos"
Metabolomics of developmental changes in Triatoma sanguisuga gut microbiota,"Triatoma sanguisuga is one of the major vectors of Trypanosoma cruzi in the southeastern US, where it sustains a robust zoonotic parasite transmission cycle and occasional human infections. A better understanding of triatomine development may allow for alternative approaches to insecticide-based vector control. Indeed, the role of the gut microbiota and bacterial endosymbionts in triatomine development and in their vectorial capacity is emerging. We investigated here the differences in microbiota among nymph and adult T. sanguisuga, to shed light on the metabolomic interactions occurring during development. Microbiota composition was assessed by 16s gene amplification and deep sequencing from field-caught adult bugs and their laboratory-raised progeny. Significant differences in microbiota bacterial diversity and composition were observed between nymphs and adults. Laboratory-raised nymphs showed a higher taxonomic diversity, and at least seven families predominated. On the other hand, field-caught adults had a lower bacterial diversity and four families comprised most of the microbiota. These differences in compositions were associated with differences in predicted metabolism, with laboratory-raised nymphs microbiota metabolizing a limited diversity of carbon sources, with potential for resource competition between bacterial families, and the production of lactic acid as a predominant fermentation product. On the other hand, field-caught adult microbiota was predicted to metabolize a broader diversity of carbon sources, with complementarity rather than competition among taxa, and produced a diverse range of products in a more balanced manner. The restricted functionality of laboratory-raised nymph microbiota may be associated with their poor development in captivity, and further understanding of the metabolic interactions at play may lead to alternative vector control strategies targeting triatomine microbiota.",2023,1,https://www.semanticscholar.org/paper/3e5ddb4a57345b1a6c3664e92be8dd54b7a7b156,3e5ddb4a57345b1a6c3664e92be8dd54b7a7b156,"Evan Teal, Claudia P Herrera, Eric Dumonteil"
A qualitative exploration of knowledge of Chagas disease among adolescents in rural Ecuador.,"INTRODUCTION
Chagas disease (CD) is a neglected tropical disease that affects 6 to 7 million people worldwide. In South America, CD is a major health problem in several regions, causing more than 12 000 deaths per year. CD is caused by a parasite called Trypanosoma cruzi, mostly transmitted through the contaminated feces of certain species of triatomine bug, commonly known as the 'kissing bug'. CD is endemic in Loja province in the southern region of Ecuador, where triatomines have been found in 68% of communities. Previous promotion of healthy practices in Loja province have included educational programs directed toward youth to affirm cultural and social norms that support health and prevent CD transmission. The present study was designed to evaluate current knowledge related to CD among youth in the three communities of Loja province following previous intervention programs.


METHODS
A descriptive, qualitative approach was applied using individual semi-structured interviews with 14 young people (eight females, six males) from three rural communities in Loja province. Interviews assessed knowledge about CD transmission, knowledge about the parasite-vector-disease pathway, and the role of youth in preventing Chagas disease in their communities.


RESULTS
Following a thematic analysis of the data, the study results showed there is cursory knowledge of the triatomine insect that can carry the causative parasite for CD. Participants were able to generally talk about the vector, habitat and prevention practices for triatomine infestation. Nevertheless, limited understanding of transmission dynamics in the parasite-vector-disease pathway itself was found. One major finding was that prevention practices were not correctly applied or followed, increasing the risk of exposure in the community. Youth also articulated that CD is stigmatized in their communities, which may be a barrier for prevention efforts.


CONCLUSION
Gaps in knowledge about the parasite-vector-disease pathway were identified among youth. Overall, youth responses indicated positive regard for prevention practices and a desire to be involved in prevention programs. Developing educational programs focusing on CD transmission may be needed to improve control and prevention of this parasitic disease. The implications of these findings are discussed for developing effective control programs in the region.",2023,1,https://www.semanticscholar.org/paper/10ddde031026b70e1bc50f1b13b1c7d868357edf,10ddde031026b70e1bc50f1b13b1c7d868357edf,"Patricia Mora-Criollo, M. Carrasco-Tenezaca, Sharon Casapulla, B. Bates, M. Grijalva"
"First record of Triatoma longipennis, Usinger, 1939 (Hemiptera: Reduviidae: Triatominae) in Tecozautla, Hidalgo","ABSTRACT Background: We report the presence of Triatoma longipennis for the first time in two localities in Hidalgo, Mexico. Methods: This study was conducted at Tecozautla municipality, Hidalgo. Collection was performed in April 2022. Results: We collected eight triatomines from Guadalupe: two fourth-instar nymphs, three fifth-instar nymphs, one female, and two males. In San Miguel Caltepantla, a female was collected inside a dwelling. One sample tested positive for Trypanosoma cruzi. Conclusions: These findings suggest the need to investigate the dynamics of this species with respect to the inhabitants of the study area.",2023,1,https://www.semanticscholar.org/paper/c0ddb4819bdad7710c7f8cabbe05f14f52c6737f,c0ddb4819bdad7710c7f8cabbe05f14f52c6737f,"Nancy Rivas, Alberto Antonio-Campos, Julio Noguez-García, R. Alejandre-Aguilar"
A Scoping Review of Mathematical Models Used to Investigate the Role of Dogs in Chagas Disease Transmission,"Simple Summary Chagas disease- caused by the parasite Trypanosoma cruzi and vectored by triatomine insects (‘kissing bugs’)- poses a serious threat to human and dog health. Mathematical modeling is an important tool to assess control interventions and determine how different factors affect disease transmission. In the Chagas disease transmission cycle, the application of mathematical modeling techniques to study the role of dogs in disease epidemiology and control has not been fully understood. The purpose of this study was to review mathematical models that investigated the role of dogs in Chagas disease transmission. We examine the modeling approaches used, assess their contribution to understanding dogs’ role in Chagas disease transmission and control, and discuss their strengths and limitations. We identified ten peer-reviewed articles. Five of the ten reviewed articles focused on evaluating the effectiveness of intervention measures to control disease transmission and three focused on estimating disease transmission risk. The reviewed studies show that dogs are not only at high risk of infection but also amplify the spread of infections in endemic areas. Moreover, these studies have demonstrated that eliminating infected dogs from households or frequent use of insecticide could be sufficient to nearly interrupt disease transmission. Abstract Chagas disease is a zoonotic vector-borne disease caused by the parasite Trypanosoma cruzi, which affects a variety of mammalian species across the Americas, including humans and dogs. Mathematical modeling has been widely used to investigate the transmission dynamics and control of vector-borne diseases. We performed a scoping review of mathematical models that investigated the role of dogs in T. cruzi transmission. We identified ten peer-reviewed papers that have explicitly modeled the role of dogs in Chagas transmission dynamics. We discuss the different methods employed in these studies, the different transmission metrics, disease transmission routes, and disease control strategies that have been considered and evaluated. In general, mathematical modeling studies have shown that dogs are not only at high risk of T. cruzi infection but are also major contributors to T. cruzi transmission to humans. Moreover, eliminating infected dogs from households or frequent use of insecticide was shown to be effective for curtailing T. cruzi transmission in both humans and dogs. However, when insecticide spraying is discontinued, T. cruzi infections in dogs were shown to return to their pre-spraying levels. We discuss the challenges and opportunities for future modeling studies to improve our understanding of Chagas disease transmission dynamics and control.",2023,1,https://www.semanticscholar.org/paper/13b34168ad392096a327f4073e14126918761dec,13b34168ad392096a327f4073e14126918761dec,"Edem Fiatsonu, Rachel E. Busselman, M. Ndeffo-Mbah"
