title,abstract,year,citationCount,url,paperId,authors
"Domestic Triatoma spp. Infections with Trypanosoma cruzi, Household Infestations, and Molecular Identification in Oaxaca, México","Simple Summary Here, we report entomological and parasitological data on triatomine vectors of Trypanosoma cruzi, the agent of Chagas disease, in a highly endemic region of México. The morphological and molecular identification of four principal domestic species, Triatoma phyllosoma, T. barberi, T. mazzotti, and T. dimidiata, was conducted, and their presence in Oaxaca was documented based on observations from this study in comparison to municipality records from prior published studies. We document the highly endophilic behavior of four triatomine species infected with T. cruzi. The present work carried out in Oaxaca was necessary for ongoing efforts to reach the goal of reducing the Chagas disease burden in Mexico and beyond. Abstract In Latin America, Mexico is the country with the second highest annual estimated number of Chagas disease cases, caused by Trypanosoma cruzi, due to vector-borne transmission. The state of Oaxaca is the location of the first documented human cases of Chagas disease in Mexico and contained the highest T. cruzi seropositive rate (3.5%) from blood donors. Here, entomological surveys, from 2017 to 2019, were conducted to collect triatomines in 124 villages of 60 municipalities. Four principal domestic Triatoma spp. (Hemiptera: Triatominae), Triatoma phyllosoma, T. barberi, T. mazzotti, and T. dimidiata, of Oaxaca, Mexico were identified by morphology and molecular analysis of the barcode region of the cytochrome oxidase 1 (cox1 or COI or CO1) gene. A total of 41 out of 83 T. phyllosoma specimens examined by microscopy were positive for T. cruzi (49%), 49 out of 171 for T. barberi (28%), 31 out of 177 for T. mazzotti (17%), and none out of 10 for T. dimidiata (0%). Overall, the infestation index was 3.1% of households containing at least one triatomine; the crowding index was a mean of two Triatoma spp./household; and the colonization index was 0.38 for households based on presence of nymphs. Geographical distribution of triatomines in Oaxaca at the municipality level and endophilic behavior is also reported. Precise identification, endophilic habits, and infection rates of these triatomines are paramount for vector control programs of the Ministry of Health of Oaxaca and beyond.",2022,1,https://www.semanticscholar.org/paper/6d13fc0f182a909da5fd34dde932ca9770e5a8e8,6d13fc0f182a909da5fd34dde932ca9770e5a8e8,"Nadia A Fernandez-Santos, J. C. Trujillo-García, S. Hamer, Lihua Wei, H. Martínez-Montoya, P. Tamez-guerra, G. Hamer, M. Rodríguez‐Pérez"
"Parasitemia and Differential Tissue Tropism in Mice Infected with Trypanosoma cruzi Isolates Obtained from Meccus phyllosoma in the State of Oaxaca, Mexico","Trypanosoma cruzi is a parasite transmitted by the feces of triatomines. Many triatomine species are found in Mexico, and various T. cruzi variants have been isolated from these species, each showing very different virulence and cell tropism. The isolates were obtained from Meccus phyllosoma specimens in three localities in the state of Oaxaca, Mexico: Tehuantitla, Vixhana, and Guichivere. The virulence of each isolate was assessed by quantifying parasitemia, survival, and histopathologic findings. The lineage of each isolate was identified using the mini-exon gene. The expression of the tssa gene during infection was detected in the heart, esophagus, gastrocnemius, and brain. Our results show that the maximum post-infection parasitemia was higher for the Tehuantitla isolate. On genotyping, all isolates were identified as T. cruzi I. The amastigotes in the heart and gastrocnemius were verified for all isolates, but in the brain only for Tehuantitla and Vixhana. The tssa expression allowed us to detect T. cruzi isolates, for Tehuantitla, predominantly in the heart. For Vixhana, a higher tssa expression was detected in gastrocnemius, and for Guichivere, it was higher in the esophagus. Results show that virulence, tropism, and tssa expression can vary, even when the isolates are derived from the same vector species, in the same region, and at similar altitudes.",2022,0,https://www.semanticscholar.org/paper/7551c09850d22570e0113a6071b2edd46bbdcfb5,7551c09850d22570e0113a6071b2edd46bbdcfb5,"A. L. Flores-Villegas, J. G. Jiménez-Cortés, James González, A. Moreno-Rodríguez, Rebeca Pérez-Cabeza de Vaca, C. Segal-Kischinevzky, M. Bucio-Torres, J. A. De Fuentes-Vicente, Elisabeth Nava-Lazaro, P. M. Salazar-schettino, M. Cabrera Bravo"
Life history data of four populations of Triatoma mexicana (Hemiptera: Reduviidae) from Central Mexico.,"Triatomine bugs are vectors for the Trypanosoma cruzi Chagas parasites, the etiological agent for Chagas disease. This study evaluated 6 epidemiologically significant behaviors (development time, number of blood meals required for molting to the next instar, mortality rate, aggressiveness, feeding duration, and defecation delay) across 4 populations of Triatoma mexicana Herrich-Schaeffer (Heteroptera: Reduviidae), a major T. cruzi vector in Central Mexico. We collected triatomines from areas characterized by high (HP), medium (MP), medium-high (MHP), and low (LP) prevalence of human T. cruzi infection. The MHP population had the shortest development time, <290 days. Both the HP and MP populations required the most blood meals to molt to the next instar, with a median of 13. Mortality rates varied across all populations, ranging from 44% to 52%. All of the tested populations showed aggressive behavior during feeding. All populations shared similar feeding durations, with most exceeding 13 min and increasing with each instar. Quick defecation, during feeding, immediately after or less than 1 min after feeding, was observed in most nymphs (78%-90%) from the MP and MHP populations and adults (74%-92%) from HP, MP, and MHP populations. Though most parameters suggest a low potential for T. mexicana to transmit T. cruzi, unique feeding and defecation behaviors in 3 populations (excluding the LP group) could elevate their epidemiological importance. These population-specific differences may contribute to the varying prevalence rates of T. cruzi infection in areas where T. mexicana is found.",2024,0,https://www.semanticscholar.org/paper/77207a5daa25ea5d819c25818bea9adefa1a5619,77207a5daa25ea5d819c25818bea9adefa1a5619,"B. Nogueda-Torres, T. Meraz-Medina, Fernando Cervantes-Hernández, M. Villagrán-Herrera, J. A. de Diego-Cabrera, J. Martínez-Ibarra"
Domestic Dog Infection with Trypanosoma cruzi from Northern and Southern Regions of Mexico.,"Background: Chagas disease or American trypanosomiasis, caused by Trypanosoma cruzi and vectored by triatomines, affects millions of people worldwide. In endemic countries including Mexico, infections in domestic animals, such as dogs, may affect the risk of human disease when they serve as a source of infection to vectors that subsequently infect humans. Materials and Methods: We conducted a cross-sectional study of 296 dogs from two cities near the northern and southern borders of Mexico: Reynosa, Tamaulipas, and Tuxtla Gutierrez, Chiapas. Infection was measured based on testing of blood using T. cruzi quantitative PCR (qPCR) and up to three antibody detection assays. The StatPak immunochromatographic assay was used to screen samples and the indirect fluorescent antibody (IFA) and multiplex microsphere immunoassay (MIA) tests were used as secondary tests on all samples that screened positive and a subset of negatives. Serologic positivity was defined based on reactivity on at least two independent tests. Results: Of the 280 samples tested for parasite DNA, two (0.7%) were positive, one of which (0.4%) was confirmed as T. cruzi discrete typing unit TcIV. Overall, 72 (24.3%) samples were reactive for T. cruzi antibodies via StatPak of which 8 were also positive using MIA and 2 were also positive using IFA (including one of the PCR-positive dogs). Overall, nine dogs (3.4%) met study criteria of positivity based on either/both serology or PCR tests. Positive dogs were found in both regions of Mexico; five (2.7%) from Reynosa and four (3.6%) from Tuxtla Gutierrez. We found no association between infection status and state of origin, sex, age group, breed group, neighborhood, and whether other pets lived in the home. Conclusion: Our results re-emphasize dogs' utility as sentinels for T. cruzi in Mexico and underscore the need for improved veterinary diagnostic tests and parasite surveillance at the household level in endemic countries.",2024,0,https://www.semanticscholar.org/paper/e9391f15fa5412f93ff430c0260f769620f0a630,e9391f15fa5412f93ff430c0260f769620f0a630,"Edward Davila, Nadia A Fernandez-Santos, J. Estrada-Franco, Lihua Wei, D. D. Velázquez-Ramírez, R. García-Miranda, Cesar Antonio Irecta Nájera, Raúl Cruz-Cadena, Carlos A. Guichard-Romero, Carlos A. Rodriguez, Rick L. Tarleton, M. Rodríguez‐Pérez, Héctor Ochoa-Díaz-López, G. Hamer, Sarah A. Hamer"
"Life history data of a Triatoma protracta nahuatlae, T. sinaloensis, and their laboratory hybrids (Hemiptera: Reduviidae)","Chagas disease is one of the most significant vector-borne diseases in Mexico. The presence of “sylvatic” triatomine vectors of Trypanosoma cruzi (Chagas) inside human dwellings necessitates estimating their vectorial capacity. To estimate this capacity in Triatoma protracta nahuatlae (Ryckman), Triatoma sinaloensis (Ryckman), and their laboratory hybrids, 6 biological parameters were examined. Triatoma sinaloensis exhibited the shortest development time (155 days), with a median of 12 blood meals. Mortality rates varied from 35% to 45% in the 3 studied cohorts. All 3 cohorts were aggressive, initiating feeding within 0.5–1 min, and had similar feeding periods ranging from 10 to 18 min. A majority (75.3–97.9%) of the hybrids defecated when feeding, immediately after feeding, or in less than 1 min post-feeding. In contrast, only 7–42% of nymphs of T. sinaloensis defecated during the same period. Our results regarding the 6 parameters studied confirm the potential role of T. p. nahuatlae as an efficient vector of T. cruzi. Triatoma sinaloensis, on the other hand, exhibited limited vectorial capacity primarily due to its poor defecation behavior. Continued surveillance of these “sylvatic” triatomine populations is necessary to prevent an epidemiological problem. Graphical Abstract",2024,1,https://www.semanticscholar.org/paper/b328d9606528a63629c16ae06575138f05344bb9,b328d9606528a63629c16ae06575138f05344bb9,"J. Martínez-Ibarra, Y. Grant-Guillén, B. Nogueda-Torres, T. Meraz-Medina, D. M. Martínez-Grant"
"Zoonotic Cycle of American Trypanosomiasis in an Endemic Region of the Argentine Chaco, Factors That Influenced a Paradigm Shift","Trypanosoma cruzi, the causative agent of Chagas disease (American trypanosomiasis), is a highly complex zoonosis that is present throughout South America, Central America, and Mexico. The transmission of this disease is influenced by various factors, including human activities like deforestation and land use changes, which may have altered the natural transmission cycles and their connection to the environment. In this study conducted in the Argentine Chaco region, we examined the transmission dynamics of T. cruzi by collecting blood samples from wild and domestic animals, as well as triatomine bugs from human dwellings, across five sites of varying anthropic intervention. Samples were analyzed for T. cruzi infection via qPCR, and we additionally examined triatomines for bloodmeal analysis via NGS amplicon sequencing. Our analysis revealed a 15.3% infection rate among 20 wild species (n = 123) and no T. cruzi presence in 9 species of domestic animals (n = 1359) or collected triatomines via qPCR. Additionally, we found chicken (34.28%), human (21.59%), and goat (19.36%) as the predominant bloodmeal sources across all sites. These findings suggest that anthropic intervention and other variables analyzed may have directly impacted the spillover dynamics of T. cruzi’s sylvatic cycle and potentially reduced its prevalence in human habitats.",2024,0,https://www.semanticscholar.org/paper/96959ff7353d9fdad3d89da017a17034ea6b2b30,96959ff7353d9fdad3d89da017a17034ea6b2b30,"Andrea Gómez-Bravo, Sebastián Cirignoli, D. Wehrendt, A. Schijman, C. León, María Flores-Chaves, Javier Nieto, Troy J. Kieran, Marcelo Abril, F. Guhl"
Development and survival of Triatoma barberi and Triatoma longipennis (Hemiptera: Reduviidae) is affected by Trypanosoma cruzi colonization,"Triatomines are insect vectors of the flagellate protozoan Trypanosoma cruzi, the causative agent of Chagas disease. This occurs when the triatomine defecates on the skin of the vertebrate host when it bites its host for feeding. This lesion causes the penetration of T. cruzi, whose infective phase is the tripomastigote, and the non-infective replicative phase epimastigote. Although the effects of T. cruzi on the development and survival of different species of triatomine bugs are known, it has not been fully described how the parasite affects many of the species that inhabit Mexico. Therefore, the present study aimed to investigate the effect of the presence of T. cruzi on triatomine development and survival. For this, five triatomines of each instar of each species, Triatoma barberi and Triatoma longipennis, were inoculated, from their second instar to their adult stage, female or male. Each triatomine was infected with 3-5 x105 parasites and they were incubated for 100 days and the kinetic of parasites in the feces and T. cruzi phases were recorded. The results showed that T. barberi and T. longipennis development was affected in all stages because of T. cruzi infection. It was greater for T. longipennis, both in its mortality, as well as time to molt in each phase.",2024,0,https://www.semanticscholar.org/paper/4737194bacbbac08f5fa33cac2270f118caf1583,4737194bacbbac08f5fa33cac2270f118caf1583,"M. A. Becerril-Flores, A. K. Benítez-Hernández, Antonio Santos-Castañeda, María del Rosario Tovar-Tomás, E. Molina-Trinidad"
"Novel finding of Panstrongylus rufotuberculatus (Champion, 1899) (Hemiptera, Reduviidae, Triatominae) in Belize, with a note on single Rhodnius Stål, 1859 species observations","We report Triatominae species Panstrongylus rufotuberculatus (Champion, 1899) for the first time in Belize. The specimen was collected in Cayo District, Belize in 2003 and later discovered in 2023 in a research collection. The distribution of P. rufotuberculatus spans Mexico to Argentina, and Belize lies within this range. This finding represents the fifth triatomine species reported in Belize, but only two species, Triatoma dimidata Latreille, 1811 and T. mopan Dorn et al., 2018, have been reported more than once. More research is needed to fully understand Triatominae biodiversity in Belize.",2024,0,https://www.semanticscholar.org/paper/f8bc9061da092e0a3cb2499a6cf97f9a0c0f134f,f8bc9061da092e0a3cb2499a6cf97f9a0c0f134f,"Jennifer K. Peterson, Charles R. Bartlett, J. de Oliveira"
Antimicrobial activity of NK cells to Trypanosoma cruzi infected human primary Keratinocytes,"Infection with the protozoan parasite Trypanosoma cruzi is causative for Chagas disease, which is a highly neglected tropical disease prevalent in Latin America. Humans are primary infected through vectorial transmission by blood-sucking triatomine bugs. The parasite enters the human host through mucous membranes or small skin lesions. Since keratinocytes are the predominant cell type in the epidermis, they play a critical role in detecting disruptions in homeostasis and aiding in pathogen elimination by the immune system in the human skin as alternative antigen-presenting cells. Interestingly, keratinocytes also act as a reservoir for T. cruzi, as the skin has been identified as a major site of persistent infection in mice with chronic Chagas disease. Moreover, there are reports of the emergence of T. cruzi amastigote nests in the skin of immunocompromised individuals who are experiencing reactivation of Chagas disease. This observation implies that the skin may serve as a site for persistent parasite presence during chronic human infection too and underscores the significance of investigating the interactions between T. cruzi and skin cells. Consequently, the primary objective of this study was to establish and characterize the infection kinetics in human primary epidermal keratinocytes (hPEK). Our investigation focused on surface molecules that either facilitated or hindered the activation of natural killer (NK) cells, which play a crucial role in controlling the infection. To simulate the in vivo situation in humans, an autologous co-culture model was developed to examine the interactions between T. cruzi infected keratinocytes and NK cells. We evaluated the degranulation, cytokine production, and cytotoxicity of NK cells in response to the infected keratinocytes. We observed a strong activation of NK cells by infected keratinocytes, despite minimal alterations in the expression of activating or inhibitory ligands on NK cell receptors. However, stimulation with recombinant interferon-gamma (IFN-γ), a cytokine known to be present in significant quantities during chronic T. cruzi infections in the host, resulted in a substantial upregulation of these ligands on primary keratinocytes. Overall, our findings suggest the crucial role of NK cells in controlling acute T. cruzi infection in the upper layer of the skin and shed light on keratinocytes as potential initial targets of infection.",2023,0,https://www.semanticscholar.org/paper/6718100b49652b56fd9e0057096369ebf7896ca6,6718100b49652b56fd9e0057096369ebf7896ca6,"Keshia Kroh, J. Barton, Helena Fehling, H. Lotter, B. Volkmer, R. Greinert, Mouna Mhamdi-Ghodbani, Andrea Vanegas, T. Jacobs, Rosa Isela Gálvez"
